{
  "case_id": "C07",
  "artifact_role": "constructed_stmk_protocol_dry_run",
  "constructed_for_protocol_dry_run": true,
  "real_repair_run_id": null,
  "headline_eligible": false,
  "repair_effectiveness_eligible": false,
  "schema_version": "r5_7_5.better_adjudication_output.v0",
  "not_real_repair_run_acknowledged": true,
  "protocol_coverage_claim_allowed": true,
  "scope_routing_status": "in_scope_t0_protocol_case",
  "run_validity_status": "valid_constructed_protocol_case",
  "primary_expected_verdict": "not_better",
  "secondary_notes": [
    "R5.7.5 expected record, not observed real repair result."
  ],
  "gate_results": {
    "G0": {
      "status": "pass",
      "reason": "C07 expected G0=pass: 删除 Signal Transmission Fails transition，使模型更简单但丢需求行为。",
      "evidence_keys": [
        "src-c07-baseline",
        "src-c07-candidate",
        "clm-c07-expected"
      ]
    },
    "G1": {
      "status": "pass",
      "reason": "C07 expected G1=pass: 删除 Signal Transmission Fails transition，使模型更简单但丢需求行为。",
      "evidence_keys": [
        "src-c07-baseline",
        "src-c07-candidate",
        "clm-c07-expected"
      ]
    },
    "G2": {
      "status": "pass",
      "reason": "C07 expected G2=pass: 删除 Signal Transmission Fails transition，使模型更简单但丢需求行为。",
      "evidence_keys": [
        "src-c07-baseline",
        "src-c07-candidate",
        "clm-c07-expected"
      ]
    },
    "G3": {
      "status": "fail",
      "reason": "C07 expected G3=fail: 删除 Signal Transmission Fails transition，使模型更简单但丢需求行为。",
      "evidence_keys": [
        "src-c07-baseline",
        "src-c07-candidate",
        "clm-c07-expected"
      ]
    },
    "G4": {
      "status": "not_applicable",
      "reason": "C07 expected G4=not_applicable: 删除 Signal Transmission Fails transition，使模型更简单但丢需求行为。",
      "evidence_keys": [
        "src-c07-baseline",
        "src-c07-candidate",
        "clm-c07-expected"
      ]
    },
    "G5": {
      "status": "fail",
      "reason": "C07 expected G5=fail: 删除 Signal Transmission Fails transition，使模型更简单但丢需求行为。",
      "evidence_keys": [
        "src-c07-baseline",
        "src-c07-candidate",
        "clm-c07-expected"
      ]
    },
    "G6": {
      "status": "pass",
      "reason": "C07 expected G6=pass: 删除 Signal Transmission Fails transition，使模型更简单但丢需求行为。",
      "evidence_keys": [
        "src-c07-baseline",
        "src-c07-candidate",
        "clm-c07-expected"
      ]
    }
  },
  "target_closure": {
    "expected": "not_better",
    "scenario_overfitting_coverage_status": "handoff_only_not_covered"
  },
  "no_regression": {
    "expected_gate_status": "fail",
    "notes": "Protocol expectation, not observed repair output."
  },
  "anti_gaming_risk_flags": [
    "semantic_deletion"
  ],
  "evidence_keys": [
    "src-c07-baseline",
    "src-c07-candidate",
    "clm-c07-expected"
  ],
  "forbidden_claims": [
    "constructed candidates are not real repair outputs",
    "no headline or repair-effectiveness claim may cite this case",
    "fcstm/pyfcstm/conversion are internal experiment media only"
  ],
  "confidence": "high",
  "human_escalation_required": false
}
